{
  "$id": "https://openfairy.local/schemas/protocol/v1/delivery.sent.json",
  "$schema": "https://json-schema.org/draft/2020-12/schema",
  "additionalProperties": true,
  "properties": {
    "actor": {
      "pattern": "^(user|agent|tool|system|subagent:[A-Za-z0-9_.-]+|workflow:[A-Za-z0-9_.-]+)$",
      "type": "string"
    },
    "id": {
      "pattern": "^evt_[0-9A-HJKMNP-TV-Z]{26}$",
      "type": "string"
    },
    "labels": {
      "additionalProperties": true,
      "properties": {
        "residency": {
          "enum": [
            "local-only",
            "region-restricted",
            "global-ok"
          ],
          "type": "string"
        },
        "sensitivity": {
          "enum": [
            "public",
            "internal",
            "personal",
            "secret"
          ],
          "type": "string"
        }
      },
      "required": [
        "sensitivity",
        "residency"
      ],
      "type": "object"
    },
    "payload": {
      "additionalProperties": true,
      "allOf": [
        {
          "if": {
            "properties": {
              "class": {
                "const": "critical"
              }
            },
            "required": [
              "class"
            ]
          },
          "then": {
            "required": [
              "storm_key"
            ]
          }
        }
      ],
      "properties": {
        "channel": {
          "minLength": 1,
          "type": "string"
        },
        "class": {
          "enum": [
            "critical",
            "briefing",
            "completion",
            "suggestion"
          ],
          "type": "string"
        },
        "created_at": {
          "pattern": "^\\d{4}-\\d{2}-\\d{2}T",
          "type": "string"
        },
        "expires_at": {
          "pattern": "^\\d{4}-\\d{2}-\\d{2}T",
          "type": "string"
        },
        "reason": {
          "minLength": 1,
          "type": "string"
        },
        "source_workflow": {
          "minLength": 1,
          "type": "string"
        },
        "storm_key": {
          "minLength": 1,
          "type": "string"
        }
      },
      "required": [
        "class",
        "channel",
        "reason",
        "source_workflow",
        "created_at"
      ],
      "type": "object"
    },
    "provenance": {
      "pattern": "^(user|agent|tool:[^\\s]+|web:[^\\s]+|mcp:[^\\s]+)$",
      "type": "string"
    },
    "sid": {
      "pattern": "^ses_[0-9A-HJKMNP-TV-Z]{26}$",
      "type": "string"
    },
    "ts": {
      "pattern": "^\\d{4}-\\d{2}-\\d{2}T\\d{2}:\\d{2}:\\d{2}\\.\\d{3}Z$",
      "type": "string"
    },
    "turn": {
      "minimum": 0,
      "type": "integer"
    },
    "type": {
      "const": "delivery.sent"
    },
    "v": {
      "const": 1
    }
  },
  "required": [
    "v",
    "id",
    "sid",
    "turn",
    "ts",
    "actor",
    "type",
    "provenance",
    "labels",
    "payload"
  ],
  "title": "Fairy protocol event delivery.sent v1",
  "type": "object"
}
