{
  "actor": "agent",
  "id": "evt_01J00000000000000000000036",
  "labels": {
    "residency": "global-ok",
    "sensitivity": "internal"
  },
  "payload": {
    "channel": "desktop",
    "class": "briefing",
    "created_at": "2026-07-02T08:00:00.000Z",
    "expires_at": "2026-07-05T08:00:00.000Z",
    "reason": "Morning briefing",
    "source_workflow": "morning"
  },
  "provenance": "agent",
  "sid": "ses_01J00000000000000000000000",
  "ts": "2026-07-02T10:00:00.000Z",
  "turn": 1,
  "type": "delivery.sent",
  "v": 1
}
